"use strict";(self.webpackChunkciroh_docuhub=self.webpackChunkciroh_docuhub||[]).push([["5365"],{17314:function(e){e.exports=JSON.parse('{"archive":{"blogPosts":[{"id":"v20260202","metadata":{"permalink":"/docuhub-staging/release-notes/v20260202","source":"@site/release-notes/2026-02-02-release-notes.mdx","title":"02-02-2026 Release Notes","description":"Major DocuHub update for [TBD]!","date":"2026-02-02T00:00:00.000Z","tags":[{"inline":true,"label":"Release Notes","permalink":"/docuhub-staging/release-notes/tags/release-notes"},{"inline":true,"label":"DocuHub","permalink":"/docuhub-staging/release-notes/tags/docu-hub"}],"readingTime":0.5,"hasTruncateMarker":true,"authors":[],"frontMatter":{"title":"02-02-2026 Release Notes","description":"Major DocuHub update for [TBD]!","slug":"v20260202","tags":["Release Notes","DocuHub"],"hide_table_of_contents":false},"unlisted":false,"nextItem":{"title":"01-09-2026 Release Notes","permalink":"/docuhub-staging/release-notes/v20260109"}},"content":":::info\\nCIROH DocuHub will be merged into CIROH Hub this February! Learn more about the transition here: [**CIROH Hub FAQ**](/ciroh-hub/)\\n:::\\n\\n## New content\\n\\n- Added CIROH Hub FAQ and banner ([#547](https://github.com/CIROH-UA/ciroh-ua_website/pull/547))\\n\\n## Blog posts and news updates\\n\\n- Blog post: [\\"CIROH Cyberinfrastructure and Hydroinformatics Team at AGU25\\"](/blog/agu2025/) ([#544](https://github.com/CIROH-UA/ciroh-ua_website/pull/544))\\n- Community NextGen News update: January 2026 Release ([#545](https://github.com/CIROH-UA/ciroh-ua_website/pull/545))\\n\\n## Updates\\n\\n- Updated name for NextGen image on CIROH-2i2c JupyterHub ([#551](https://github.com/CIROH-UA/ciroh-ua_website/pull/551))\\n\\n\x3c!-- truncate --\x3e"},{"id":"v20260109","metadata":{"permalink":"/docuhub-staging/release-notes/v20260109","source":"@site/release-notes/2026-01-09-release-notes.mdx","title":"01-09-2026 Release Notes","description":"Minor DocuHub update for January 2026!","date":"2026-01-09T00:00:00.000Z","tags":[{"inline":true,"label":"Release Notes","permalink":"/docuhub-staging/release-notes/tags/release-notes"},{"inline":true,"label":"DocuHub","permalink":"/docuhub-staging/release-notes/tags/docu-hub"}],"readingTime":0.15,"hasTruncateMarker":true,"authors":[],"frontMatter":{"title":"01-09-2026 Release Notes","description":"Minor DocuHub update for January 2026!","slug":"v20260109","tags":["Release Notes","DocuHub"],"hide_table_of_contents":false},"unlisted":false,"prevItem":{"title":"02-02-2026 Release Notes","permalink":"/docuhub-staging/release-notes/v20260202"},"nextItem":{"title":"12-12-2025 Release Notes","permalink":"/docuhub-staging/release-notes/v20251212"}},"content":"## Blog posts and news updates\\n- Blog post: [\\"AWS re:Invent 2025: Key Insights for Research and Cyberinfrastructure\\"](/blog/aws-reinvent-2025/) ([#526](https://github.com/CIROH-UA/ciroh-ua_website/pull/526))\\n\\n\x3c!-- truncate --\x3e"},{"id":"v20251212","metadata":{"permalink":"/docuhub-staging/release-notes/v20251212","source":"@site/release-notes/2025-12-12-release-notes.mdx","title":"12-12-2025 Release Notes","description":"Minor DocuHub update for December 2025!","date":"2025-12-12T00:00:00.000Z","tags":[{"inline":true,"label":"Release Notes","permalink":"/docuhub-staging/release-notes/tags/release-notes"},{"inline":true,"label":"DocuHub","permalink":"/docuhub-staging/release-notes/tags/docu-hub"}],"readingTime":0.19,"hasTruncateMarker":true,"authors":[],"frontMatter":{"title":"12-12-2025 Release Notes","description":"Minor DocuHub update for December 2025!","slug":"v20251212","tags":["Release Notes","DocuHub"],"hide_table_of_contents":false},"unlisted":false,"prevItem":{"title":"01-09-2026 Release Notes","permalink":"/docuhub-staging/release-notes/v20260109"},"nextItem":{"title":"12-09-2025 Release Notes","permalink":"/docuhub-staging/release-notes/v20251209"}},"content":"## New content\\n- Added CIROH Hydrologic Prediction Testbed to Products section ([#523](https://github.com/CIROH-UA/ciroh-ua_website/pull/523))\\n\\n## Updates\\n- Updated links for BigQuery API access requests ([#522](https://github.com/CIROH-UA/ciroh-ua_website/pull/522))\\n\x3c!-- truncate --\x3e"},{"id":"v20251209","metadata":{"permalink":"/docuhub-staging/release-notes/v20251209","source":"@site/release-notes/2025-12-09-release-notes.mdx","title":"12-09-2025 Release Notes","description":"Minor DocuHub update for December 2025!","date":"2025-12-09T00:00:00.000Z","tags":[{"inline":true,"label":"Release Notes","permalink":"/docuhub-staging/release-notes/tags/release-notes"},{"inline":true,"label":"DocuHub","permalink":"/docuhub-staging/release-notes/tags/docu-hub"}],"readingTime":0.23,"hasTruncateMarker":true,"authors":[],"frontMatter":{"title":"12-09-2025 Release Notes","description":"Minor DocuHub update for December 2025!","slug":"v20251209","tags":["Release Notes","DocuHub"],"hide_table_of_contents":false},"unlisted":false,"prevItem":{"title":"12-12-2025 Release Notes","permalink":"/docuhub-staging/release-notes/v20251212"},"nextItem":{"title":"11-26-2025 Release Notes","permalink":"/docuhub-staging/release-notes/v20251126"}},"content":"## New content\\n- Added Standard Operating Procedures to policies page ([#519](https://github.com/CIROH-UA/ciroh-ua_website/pull/519))\\n\\n## Updates\\n- Revised blog post [\\"Moving Hydrologic Prediction Forward\\"](/blog/software-integration-meeting/) to improve credit to collaborators ([#518](https://github.com/CIROH-UA/ciroh-ua_website/pull/518))\\n\x3c!-- truncate --\x3e"},{"id":"v20251126","metadata":{"permalink":"/docuhub-staging/release-notes/v20251126","source":"@site/release-notes/2025-11-26-release-notes.mdx","title":"11-26-2025 Release Notes","description":"Major DocuHub update for November 2025!","date":"2025-11-26T00:00:00.000Z","tags":[{"inline":true,"label":"Release Notes","permalink":"/docuhub-staging/release-notes/tags/release-notes"},{"inline":true,"label":"DocuHub","permalink":"/docuhub-staging/release-notes/tags/docu-hub"}],"readingTime":0.5,"hasTruncateMarker":true,"authors":[],"frontMatter":{"title":"11-26-2025 Release Notes","description":"Major DocuHub update for November 2025!","slug":"v20251126","tags":["Release Notes","DocuHub"],"hide_table_of_contents":false},"unlisted":false,"prevItem":{"title":"12-09-2025 Release Notes","permalink":"/docuhub-staging/release-notes/v20251209"},"nextItem":{"title":"11-03-2025 Release Notes","permalink":"/docuhub-staging/release-notes/v20251103"}},"content":"## Blog posts and news updates\\n- Blog post: [\\"Moving Hydrologic Prediction Forward \u2014 A software integration meeting at the Alabama Water Institute\\"](/blog/software-integration-meeting/) ([#511](https://github.com/CIROH-UA/ciroh-ua_website/pull/511))\\n- Community NextGen News update: November 2025 Release ([#514](https://github.com/CIROH-UA/ciroh-ua_website/pull/514))\\n\\n## Updates\\n- Revise product request template for submissions ([#509](https://github.com/CIROH-UA/ciroh-ua_website/pull/509))\\n- Update index.mdx - HydroServer documentation ([#512](https://github.com/CIROH-UA/ciroh-ua_website/pull/512))\\n- Add year and month dropdowns to news page for better navigation ([#513](https://github.com/CIROH-UA/ciroh-ua_website/pull/513))\\n\x3c!-- truncate --\x3e"},{"id":"v20251103","metadata":{"permalink":"/docuhub-staging/release-notes/v20251103","source":"@site/release-notes/2025-11-03-release-notes.mdx","title":"11-03-2025 Release Notes","description":"Major DocuHub update for November 2025!","date":"2025-11-03T00:00:00.000Z","tags":[{"inline":true,"label":"Release Notes","permalink":"/docuhub-staging/release-notes/tags/release-notes"},{"inline":true,"label":"DocuHub","permalink":"/docuhub-staging/release-notes/tags/docu-hub"}],"readingTime":0.94,"hasTruncateMarker":true,"authors":[],"frontMatter":{"title":"11-03-2025 Release Notes","description":"Major DocuHub update for November 2025!","slug":"v20251103","tags":["Release Notes","DocuHub"],"hide_table_of_contents":false},"unlisted":false,"prevItem":{"title":"11-26-2025 Release Notes","permalink":"/docuhub-staging/release-notes/v20251126"},"nextItem":{"title":"10-01-2025 Release Notes","permalink":"/docuhub-staging/release-notes/v20251001"}},"content":"## New content\\n- Infrastructure Access page redesigned with modern UI and navigation [#492](https://github.com/CIROH-UA/ciroh-ua_website/pull/492)\\n- NRDS product page reorganized to reflect the new directory structure ([#495](https://github.com/CIROH-UA/ciroh-ua_website/pull/495))\\n- Added product page for `rust-lstm` ([#502](https://github.com/CIROH-UA/ciroh-ua_website/pull/502))\\n\\n## Blog posts and news updates\\n- Blog post: [\\"Building Bridges: CIROH\u2013Penn State Collaboration Formalizes Differentiable Modeling for NRDS\\"](/blog/ciroh-psu-collab) ([#500](https://github.com/CIROH-UA/ciroh-ua_website/pull/500))\\n- News update: October 2025 ([#494](https://github.com/CIROH-UA/ciroh-ua_website/pull/494))\\n\\n## Updates\\n- Adjusted mentions of CIROH-2i2c JupyterHub site-wide for consistency ([#501](https://github.com/CIROH-UA/ciroh-ua_website/pull/501))\\n- Updated to Docusaurus 3.9.2 ([#483](https://github.com/CIROH-UA/ciroh-ua_website/pull/483), [#496](https://github.com/CIROH-UA/ciroh-ua_website/pull/496))\\n- Minor content adjustments to NWM BigQuery page ([#488](https://github.com/CIROH-UA/ciroh-ua_website/pull/488))\\n- Minor content adjustments to Services landing page ([#487](https://github.com/CIROH-UA/ciroh-ua_website/pull/487))\\n- Adjusted content of HydroShare documentation ([#482](https://github.com/CIROH-UA/ciroh-ua_website/pull/482))\\n\x3c!-- truncate --\x3e"},{"id":"v20251001","metadata":{"permalink":"/docuhub-staging/release-notes/v20251001","source":"@site/release-notes/2025-10-01-release-notes.mdx","title":"10-01-2025 Release Notes","description":"Major DocuHub update for October 2025!","date":"2025-10-01T00:00:00.000Z","tags":[{"inline":true,"label":"Release Notes","permalink":"/docuhub-staging/release-notes/tags/release-notes"},{"inline":true,"label":"DocuHub","permalink":"/docuhub-staging/release-notes/tags/docu-hub"}],"readingTime":0.68,"hasTruncateMarker":true,"authors":[],"frontMatter":{"title":"10-01-2025 Release Notes","description":"Major DocuHub update for October 2025!","slug":"v20251001","tags":["Release Notes","DocuHub"],"hide_table_of_contents":false},"unlisted":false,"prevItem":{"title":"11-03-2025 Release Notes","permalink":"/docuhub-staging/release-notes/v20251103"},"nextItem":{"title":"09-12-2025 Release Notes","permalink":"/docuhub-staging/release-notes/v20250912"}},"content":"## New content\\n- Reorganized 2i2c documentation, with new content pages for HydroShare integration and available server images ([#479](https://github.com/CIROH-UA/ciroh-ua_website/pull/479))\\n- Revamped HydroShare documentation to focus on HydroShare itself ([#479](https://github.com/CIROH-UA/ciroh-ua_website/pull/479))\\n\\n## Blog posts and news updates\\n- Blog post: [\\"From Research to Impact: CIROH Science Meeting 2025 Resources and Reflections\\"](/blog/science-meeting-2025) ([#475](https://github.com/CIROH-UA/ciroh-ua_website/pull/475))\\n- Blog post: [\\"Focusing on Streamflow Data: New Software for Camera-Based Hydrologic Modeling\\"](/blog/streamflow-data-camera-based-hydrologic-modeling-software) ([#474](https://github.com/CIROH-UA/ciroh-ua_website/pull/474))\\n- News update: September 2025 ([#478](https://github.com/CIROH-UA/ciroh-ua_website/pull/478))\\n\\n## Updates\\n- Added local mirror of NOAA Data Sharing Directive [#473](https://github.com/CIROH-UA/ciroh-ua_website/pull/473)\\n\\n\x3c!-- truncate --\x3e"},{"id":"v20250912","metadata":{"permalink":"/docuhub-staging/release-notes/v20250912","source":"@site/release-notes/2025-09-12-release-notes.mdx","title":"09-12-2025 Release Notes","description":"Minor DocuHub update for September 2025!","date":"2025-09-12T00:00:00.000Z","tags":[{"inline":true,"label":"Release Notes","permalink":"/docuhub-staging/release-notes/tags/release-notes"},{"inline":true,"label":"DocuHub","permalink":"/docuhub-staging/release-notes/tags/docu-hub"}],"readingTime":0.52,"hasTruncateMarker":true,"authors":[],"frontMatter":{"title":"09-12-2025 Release Notes","description":"Minor DocuHub update for September 2025!","slug":"v20250912","tags":["Release Notes","DocuHub"],"hide_table_of_contents":false},"unlisted":false,"prevItem":{"title":"10-01-2025 Release Notes","permalink":"/docuhub-staging/release-notes/v20251001"},"nextItem":{"title":"08-29-2025 Release Notes","permalink":"/docuhub-staging/release-notes/v20250829"}},"content":"> *Note that several changes in this release were published earlier as hotfixes.*\\n\\n## Updates\\n- Added redirect and announcement banner for Science Meeting 2025 Survey ([#472](https://github.com/CIROH-UA/ciroh-ua_website/pull/472), [#470](https://github.com/CIROH-UA/ciroh-ua_website/pull/470))\\n- Fixes to Community Impact page ([#471](https://github.com/CIROH-UA/ciroh-ua_website/pull/471), [#468](https://github.com/CIROH-UA/ciroh-ua_website/pull/468))\\n- Corrected error in \\"NWM, NextGen, and NGIAB\\" page ([#469](https://github.com/CIROH-UA/ciroh-ua_website/pull/469))\\n- Updated news entries for NGIAB-HPCInfra and CIROH community forks of ngen/troute ([#467](https://github.com/CIROH-UA/ciroh-ua_website/pull/467))\\n\\n\x3c!-- truncate --\x3e"},{"id":"v20250829","metadata":{"permalink":"/docuhub-staging/release-notes/v20250829","source":"@site/release-notes/2025-08-29-release-notes.mdx","title":"08-29-2025 Release Notes","description":"Major DocuHub update for August 2025!","date":"2025-08-29T00:00:00.000Z","tags":[{"inline":true,"label":"Release Notes","permalink":"/docuhub-staging/release-notes/tags/release-notes"},{"inline":true,"label":"DocuHub","permalink":"/docuhub-staging/release-notes/tags/docu-hub"}],"readingTime":0.74,"hasTruncateMarker":true,"authors":[],"frontMatter":{"title":"08-29-2025 Release Notes","description":"Major DocuHub update for August 2025!","slug":"v20250829","tags":["Release Notes","DocuHub"],"hide_table_of_contents":false},"unlisted":false,"prevItem":{"title":"09-12-2025 Release Notes","permalink":"/docuhub-staging/release-notes/v20250912"},"nextItem":{"title":"08-01-2025 Release Notes","permalink":"/docuhub-staging/release-notes/v20250801"}},"content":"## New content\\n- Added product pages for CIROH\'s community forks of NextGen repositories ([#460](https://github.com/CIROH-UA/ciroh-ua_website/pull/460))\\n\\n## Blog posts and news updates\\n- Blog post: [\\"Cross-Institutional Collaboration Enhances Hydrologic Modeling in the Logan River Watershed\\"](/blog/logan-river-collaboration) ([#457](https://github.com/CIROH-UA/ciroh-ua_website/pull/457))\\n- Blog post: [\\"Evaluating NextGen\u2019s Performance in the MARFC Region with NGIAB\\"](/blog/nextgen-marfc-performance) ([#453](https://github.com/CIROH-UA/ciroh-ua_website/pull/453))\\n- News update: August 2025 ([#462](https://github.com/CIROH-UA/ciroh-ua_website/pull/446))\\n   - **Hotfix, 9/2:** Updated news entries for NGIAB-HPCInfra and CIROH community forks of ngen/troute.\\n\\n## Updates\\n- Added link to NGIAB\'s academic paper in \\"NGIAB Reaches 10,000 Docker Pulls\\" ([#462](https://github.com/CIROH-UA/ciroh-ua_website/pull/462))\\n- Minor updates and visual improvements to the Community Impact page ([#461](https://github.com/CIROH-UA/ciroh-ua_website/pull/461))\\n\\n\x3c!-- truncate --\x3e"},{"id":"v20250801","metadata":{"permalink":"/docuhub-staging/release-notes/v20250801","source":"@site/release-notes/2025-08-01-release-notes.mdx","title":"08-01-2025 Release Notes","description":"Major DocuHub update for August 2025!","date":"2025-08-01T00:00:00.000Z","tags":[{"inline":true,"label":"Release Notes","permalink":"/docuhub-staging/release-notes/tags/release-notes"},{"inline":true,"label":"DocuHub","permalink":"/docuhub-staging/release-notes/tags/docu-hub"}],"readingTime":0.57,"hasTruncateMarker":true,"authors":[],"frontMatter":{"title":"08-01-2025 Release Notes","description":"Major DocuHub update for August 2025!","slug":"v20250801","tags":["Release Notes","DocuHub"],"hide_table_of_contents":false},"unlisted":false,"prevItem":{"title":"08-29-2025 Release Notes","permalink":"/docuhub-staging/release-notes/v20250829"},"nextItem":{"title":"07-24-2025 Release Notes","permalink":"/docuhub-staging/release-notes/v20250724"}},"content":"## Blog posts and news updates\\n- Blog post: [\\"NGIAB Reaches 10,000 Docker Pulls: NextGen In A Box Makes Water Modeling More Accessible\\"](/blog/ngiab-10k) ([#448](https://github.com/CIROH-UA/ciroh-ua_website/pull/448))\\n- Blog post: [\\"Tethys Summit 2025: Advancing Geoscience with Open-Source Web Apps\\"](/blog/tethys-summit-2025) ([#445](https://github.com/CIROH-UA/ciroh-ua_website/pull/445))\\n- Blog post: [\\"CIROH Researchers Showcase Cutting-Edge Hydrologic Science at NHWC 2025\\"](/blog/nhwc-2025) ([#444](https://github.com/CIROH-UA/ciroh-ua_website/pull/444))\\n- News update: July 2025 ([#446](https://github.com/CIROH-UA/ciroh-ua_website/pull/446))\\n\\n## Updates\\n- The NextGen News page has received a new look! ([#447](https://github.com/CIROH-UA/ciroh-ua_website/pull/447))\\n\\n\x3c!-- truncate --\x3e"},{"id":"v20250724","metadata":{"permalink":"/docuhub-staging/release-notes/v20250724","source":"@site/release-notes/2025-07-24-release-notes.mdx","title":"07-24-2025 Release Notes","description":"Minor DocuHub updates for July 2025!","date":"2025-07-24T00:00:00.000Z","tags":[{"inline":true,"label":"Release Notes","permalink":"/docuhub-staging/release-notes/tags/release-notes"},{"inline":true,"label":"DocuHub","permalink":"/docuhub-staging/release-notes/tags/docu-hub"}],"readingTime":0.58,"hasTruncateMarker":true,"authors":[],"frontMatter":{"title":"07-24-2025 Release Notes","description":"Minor DocuHub updates for July 2025!","slug":"v20250724","tags":["Release Notes","DocuHub"],"hide_table_of_contents":false},"unlisted":false,"prevItem":{"title":"08-01-2025 Release Notes","permalink":"/docuhub-staging/release-notes/v20250801"},"nextItem":{"title":"07-01-2025 Release Notes","permalink":"/docuhub-staging/release-notes/v20250701"}},"content":"## Updates\\n- Education tab has been **deprecated** ([#440](https://github.com/CIROH-UA/ciroh-ua_website/pull/440), [#443](https://github.com/CIROH-UA/ciroh-ua_website/pull/443))\\n  - *[CIROH Portal](https://portal.ciroh.org/presentations) is now CIROH\'s primary hub for conference material and online lessons.*\\n  - Relocated information on NWM-affiliated technologies to Products tab\\n  - Homepage and navbars rearranged accordingly\\n- Mirrored new documentation pages from NGIAB-CloudInfra ([#442](https://github.com/CIROH-UA/ciroh-ua_website/pull/442))\\n- Added notice regarding storage limits on 2i2c ([#438](https://github.com/CIROH-UA/ciroh-ua_website/pull/438))\\n- Resized a screenshot on the blog post \\"[AORC Data in Your Hands](/blog/aorc-data-access)\\" and added a caption ([#437](https://github.com/CIROH-UA/ciroh-ua_website/pull/437))\\n\\n\x3c!-- truncate --\x3e"},{"id":"v20250701","metadata":{"permalink":"/docuhub-staging/release-notes/v20250701","source":"@site/release-notes/2025-07-01-release-notes.mdx","title":"07-01-2025 Release Notes","description":"Major DocuHub update for July 2025!","date":"2025-07-01T00:00:00.000Z","tags":[{"inline":true,"label":"Release Notes","permalink":"/docuhub-staging/release-notes/tags/release-notes"},{"inline":true,"label":"DocuHub","permalink":"/docuhub-staging/release-notes/tags/docu-hub"}],"readingTime":0.7,"hasTruncateMarker":true,"authors":[],"frontMatter":{"title":"07-01-2025 Release Notes","description":"Major DocuHub update for July 2025!","slug":"v20250701","tags":["Release Notes","DocuHub"],"hide_table_of_contents":false},"unlisted":false,"prevItem":{"title":"07-24-2025 Release Notes","permalink":"/docuhub-staging/release-notes/v20250724"},"nextItem":{"title":"06-11-2025 Release Notes","permalink":"/docuhub-staging/release-notes/v20250611"}},"content":"## Blog posts and news updates\\n- Blog post: [\\"AORC Data in Your Hands: User-Friendly Jupyter Notebooks for Data Retrieval and Analysis via CIROH-2i2c JupyterHub Notebooks\\"](/blog/aorc-data-access) ([#434](https://github.com/CIROH-UA/ciroh-ua_website/pull/434))\\n- Blog post: [\\"Assessing Streamflow Forecast Over the Hackensack River Watershed Using NGIAB\\"](/blog/ismart-ngiab-application) ([#431](https://github.com/CIROH-UA/ciroh-ua_website/pull/431))\\n- News update: June 2025 ([#432](https://github.com/CIROH-UA/ciroh-ua_website/pull/432))\\n\\n## Updates\\n- Site-wide improvements and additions to tags ([#435](https://github.com/CIROH-UA/ciroh-ua_website/pull/435))\\n  - Added new \\"Community Spotlight\\" tag to blog, highlighting key application of CIROH\'s tooling and cyberinfrastructure across the community\\n  - Added new \\"Data Preparation\\" tag, highlighting tools and research that accelerate the retrieval and preprocessing of data\\n  - Increased distribution of \\"NGIAB\\" tag across older blog posts\\n\\n\x3c!-- truncate --\x3e"},{"id":"v20250611","metadata":{"permalink":"/docuhub-staging/release-notes/v20250611","source":"@site/release-notes/2025-06-11-release-notes.mdx","title":"06-11-2025 Release Notes","description":"Major DocuHub update for June 2025!","date":"2025-06-11T00:00:00.000Z","tags":[{"inline":true,"label":"Release Notes","permalink":"/docuhub-staging/release-notes/tags/release-notes"},{"inline":true,"label":"DocuHub","permalink":"/docuhub-staging/release-notes/tags/docu-hub"}],"readingTime":1.08,"hasTruncateMarker":true,"authors":[],"frontMatter":{"title":"06-11-2025 Release Notes","description":"Major DocuHub update for June 2025!","slug":"v20250611","tags":["Release Notes","DocuHub"],"hide_table_of_contents":false},"unlisted":false,"prevItem":{"title":"07-01-2025 Release Notes","permalink":"/docuhub-staging/release-notes/v20250701"},"nextItem":{"title":"06-04-2025 Release Notes","permalink":"/docuhub-staging/release-notes/v20250604"}},"content":"## New content\\n- The \\"Community Hydrologic Modeling\\" tab has been completely reworked! It\'s now called \\"NextGen In A Box\\", better reflecting the content of the folder. ([#427](https://github.com/CIROH-UA/ciroh-ua_website/pull/427))\\n    - Lots of new content has been added alongside this change within the \\"Intro to NGIAB\\" sub-section.\\n    - NGIAB product subpages have been reorganized into the \\"Distributions\\" and \\"Components\\" sub-sections.\\n    - As a part of this transition, content regarding the Reseach Datastream (formerly \\"NextGen Datastream\\") has been spun out into its own category.\\n- The \\"Research Datastream\\" tab now correctly includes its documentation subpages from GitHub. ([#425](https://github.com/CIROH-UA/ciroh-ua_website/pull/425))\\n\\n## Updates\\n- General corrections and upkeep to past news and release notes ([#426](https://github.com/CIROH-UA/ciroh-ua_website/pull/426))\\n- Reformatted the way that DocuHub renders external README files ([#425](https://github.com/CIROH-UA/ciroh-ua_website/pull/425))\\n- Refactored URLs site-wide to remove spaces ([#423](https://github.com/CIROH-UA/ciroh-ua_website/pull/423))\\n- Upgraded to Docusaurus 3.8; enabled preview functionality for 4.0 ([#420](https://github.com/CIROH-UA/ciroh-ua_website/pull/420))\\n\\n<br />\\n\\n> *Please note that this update alters the URLs of many DocuHub pages. We\'ve added redirects from their old locations to avoid breaking external links, but updating links to the new URLs is strongly preferred.*\\n\\n\x3c!-- truncate --\x3e"},{"id":"v20250604","metadata":{"permalink":"/docuhub-staging/release-notes/v20250604","source":"@site/release-notes/2025-06-04-release-notes.mdx","title":"06-04-2025 Release Notes","description":"Major DocuHub update for June 2025!","date":"2025-06-04T00:00:00.000Z","tags":[{"inline":true,"label":"Release Notes","permalink":"/docuhub-staging/release-notes/tags/release-notes"},{"inline":true,"label":"DocuHub","permalink":"/docuhub-staging/release-notes/tags/docu-hub"}],"readingTime":0.77,"hasTruncateMarker":true,"authors":[],"frontMatter":{"title":"06-04-2025 Release Notes","description":"Major DocuHub update for June 2025!","slug":"v20250604","tags":["Release Notes","DocuHub"],"hide_table_of_contents":false},"unlisted":false,"prevItem":{"title":"06-11-2025 Release Notes","permalink":"/docuhub-staging/release-notes/v20250611"},"nextItem":{"title":"05-27-2025 Release Notes","permalink":"/docuhub-staging/release-notes/v20250527"}},"content":"## Blog posts and news updates\\n- Blog post: [\\"DevCon 2025: A DevOps and Cyberinfrastructure Success Story\\"](/blog/devcon25-infra) ([#414](https://github.com/CIROH-UA/ciroh-ua_website/pull/414))\\n- Blog post: [\\"Application of NOAA-OWP\'s NextGen Framework: DevCon 2025 and EWRI Congress 2025 Highlights\\"](/blog/ewri-devcon25-ngiab) ([#411](https://github.com/CIROH-UA/ciroh-ua_website/pull/411))\\n- Blog post: [\\"DevCon 2025: Hydroinformatics and Research CyberInfrastructure Keynote\\"](/blog/devcon25-keynote) ([#407](https://github.com/CIROH-UA/ciroh-ua_website/pull/407))\\n- News update: May 2025 ([#408](https://github.com/CIROH-UA/ciroh-ua_website/pull/408))\\n\\n## Updates\\n- Moved several NGIAB tutorials to a new, generalized header ([#415](https://github.com/CIROH-UA/ciroh-ua_website/pull/415))\\n- Added \\"CIROH Research Cyberinfrastructure\\" video to [Services](/docs/services/intro) landing page ([#413](https://github.com/CIROH-UA/ciroh-ua_website/pull/413))\\n- Improvements to CI/CD pipelining ([#409](https://github.com/CIROH-UA/ciroh-ua_website/pull/409), [#395](https://github.com/CIROH-UA/ciroh-ua_website/pull/395))\\n\\n\x3c!-- truncate --\x3e"},{"id":"v20250527","metadata":{"permalink":"/docuhub-staging/release-notes/v20250527","source":"@site/release-notes/2025-05-27-release-notes.mdx","title":"05-27-2025 Release Notes","description":"Major DocuHub update for May 2025!","date":"2025-05-27T00:00:00.000Z","tags":[{"inline":true,"label":"Release Notes","permalink":"/docuhub-staging/release-notes/tags/release-notes"},{"inline":true,"label":"DocuHub","permalink":"/docuhub-staging/release-notes/tags/docu-hub"}],"readingTime":0.31,"hasTruncateMarker":true,"authors":[],"frontMatter":{"title":"05-27-2025 Release Notes","description":"Major DocuHub update for May 2025!","slug":"v20250527","tags":["Release Notes","DocuHub"],"hide_table_of_contents":false},"unlisted":false,"prevItem":{"title":"06-04-2025 Release Notes","permalink":"/docuhub-staging/release-notes/v20250604"},"nextItem":{"title":"05-22-2025 Release Notes","permalink":"/docuhub-staging/release-notes/v20250522"}},"content":"## New content\\n- Added NextGen on CIROH-2i2c JupyterHub to Products section ([#404](https://github.com/CIROH-UA/ciroh-ua_website/pull/404))\\n\\n## Updates\\n- Updated CIROH Portal under Products section with tables, emojis, and grammar fixes ([#403](https://github.com/CIROH-UA/ciroh-ua_website/pull/403))\\n- Updated documentation for \\"FIM Database for Multi-Model Visualization\\" ([#402](https://github.com/CIROH-UA/ciroh-ua_website/pull/402))\\n\x3c!-- truncate --\x3e"},{"id":"v20250522","metadata":{"permalink":"/docuhub-staging/release-notes/v20250522","source":"@site/release-notes/2025-05-22-release-notes.mdx","title":"05-22-2025 Release Notes","description":"Major DocuHub update for May 2025!","date":"2025-05-22T00:00:00.000Z","tags":[{"inline":true,"label":"Release Notes","permalink":"/docuhub-staging/release-notes/tags/release-notes"},{"inline":true,"label":"DocuHub","permalink":"/docuhub-staging/release-notes/tags/docu-hub"}],"readingTime":0.45,"hasTruncateMarker":true,"authors":[],"frontMatter":{"title":"05-22-2025 Release Notes","description":"Major DocuHub update for May 2025!","slug":"v20250522","tags":["Release Notes","DocuHub"],"hide_table_of_contents":false},"unlisted":false,"prevItem":{"title":"05-27-2025 Release Notes","permalink":"/docuhub-staging/release-notes/v20250527"},"nextItem":{"title":"05-16-2025 Release Notes","permalink":"/docuhub-staging/release-notes/v20250516"}},"content":"## New content\\n- Added CIROH RIVR App to Products section ([#389](https://github.com/CIROH-UA/ciroh-ua_website/pull/389))\\n- Added FIM Database for Multi-Model Visualization to Products section ([#393](https://github.com/CIROH-UA/ciroh-ua_website/pull/393))\\n\\n## Updates\\n- Updated NGIAB E2E Workflow Video: Local setup page with the latest instructions ([#385](https://github.com/CIROH-UA/ciroh-ua_website/pull/385))\\n- Added more information on ngiab-cal ([#387](https://github.com/CIROH-UA/ciroh-ua_website/pull/387))\\n- Added link to DevCon25 Workshop JupyterHub ([#398](https://github.com/CIROH-UA/ciroh-ua_website/pull/398))\\n\\n\x3c!-- truncate --\x3e"},{"id":"v20250516","metadata":{"permalink":"/docuhub-staging/release-notes/v20250516","source":"@site/release-notes/2025-05-16-release-notes.mdx","title":"05-16-2025 Release Notes","description":"Major DocuHub update for May 2025!","date":"2025-05-16T00:00:00.000Z","tags":[{"inline":true,"label":"Release Notes","permalink":"/docuhub-staging/release-notes/tags/release-notes"},{"inline":true,"label":"DocuHub","permalink":"/docuhub-staging/release-notes/tags/docu-hub"}],"readingTime":0.71,"hasTruncateMarker":true,"authors":[],"frontMatter":{"title":"05-16-2025 Release Notes","description":"Major DocuHub update for May 2025!","slug":"v20250516","tags":["Release Notes","DocuHub"],"hide_table_of_contents":false},"unlisted":false,"prevItem":{"title":"05-22-2025 Release Notes","permalink":"/docuhub-staging/release-notes/v20250522"},"nextItem":{"title":"05-05-2025 Release Notes","permalink":"/docuhub-staging/release-notes/v20250505"}},"content":"## New content\\n- Added NGIAB-Calibration to Products section ([#378](https://github.com/CIROH-UA/ciroh-ua_website/pull/378))\\n- Added a dashboard for NGIAB and CIROH repositories to Products section ([#374](https://github.com/CIROH-UA/ciroh-ua_website/pull/374))\\n- Added Community Hydrofabic Patcher to Products section ([#354](https://github.com/CIROH-UA/ciroh-ua_website/pull/354))\\n\\n## Blog posts and news updates\\n- Blog post: [\\"\u03B4HBV2.0: How NGIAB Streamlined Advanced Hydrologic Modeling\\"](/blog/may-2025-update) ([#379](https://github.com/CIROH-UA/ciroh-ua_website/pull/379))\\n- News update: April 2025 ([#376](https://github.com/CIROH-UA/ciroh-ua_website/pull/376))\\n\\n## Updates\\n- Added message from CIROH DocuHub team in footer ([#372](https://github.com/CIROH-UA/ciroh-ua_website/pull/372))\\n- Added descriptive headers to News and Blog pages ([#371](https://github.com/CIROH-UA/ciroh-ua_website/pull/371))\\n- Updated CIROH funding acknowledgement ([#370](https://github.com/CIROH-UA/ciroh-ua_website/pull/370))\\n\\n\x3c!-- truncate --\x3e"},{"id":"v20250505","metadata":{"permalink":"/docuhub-staging/release-notes/v20250505","source":"@site/release-notes/2025-05-05-release-notes.mdx","title":"05-05-2025 Release Notes","description":"Major DocuHub update for May 2025!","date":"2025-05-05T00:00:00.000Z","tags":[{"inline":true,"label":"Release Notes","permalink":"/docuhub-staging/release-notes/tags/release-notes"},{"inline":true,"label":"DocuHub","permalink":"/docuhub-staging/release-notes/tags/docu-hub"}],"readingTime":0.96,"hasTruncateMarker":true,"authors":[],"frontMatter":{"title":"05-05-2025 Release Notes","description":"Major DocuHub update for May 2025!","slug":"v20250505","tags":["Release Notes","DocuHub"],"hide_table_of_contents":false},"unlisted":false,"prevItem":{"title":"05-16-2025 Release Notes","permalink":"/docuhub-staging/release-notes/v20250516"},"nextItem":{"title":"04-16-2025 Release Notes","permalink":"/docuhub-staging/release-notes/v20250416"}},"content":"## New content\\n- Added researcher testimonials to homepage ([#358](https://github.com/CIROH-UA/ciroh-ua_website/pull/358))\\n- DocuHub now has a release notes feed! ([#318](https://github.com/CIROH-UA/ciroh-ua_website/pull/318))\\n\\n## Updates\\n- Added workshop IT support form to services access page ([#362](https://github.com/CIROH-UA/ciroh-ua_website/pull/362))\\n- Reorganized links to blogs for cloud services ([#360](https://github.com/CIROH-UA/ciroh-ua_website/pull/360))\\n- Video tutorial added to \\"HydroShare and CIROH-2i2c JupyterHub Integration\\" product page ([#357](https://github.com/CIROH-UA/ciroh-ua_website/pull/357))\\n- Reworked homepage display of CIROH sponsors, members, and partners ([#356](https://github.com/CIROH-UA/ciroh-ua_website/pull/356))\\n- Added link to CIROH Portal in DocuHub navbar ([#355](https://github.com/CIROH-UA/ciroh-ua_website/pull/355))\\n- All page tags have been refactored and condensed ([#352](https://github.com/CIROH-UA/ciroh-ua_website/pull/352))\\n- New landing page images for Products, Public Cloud Services, and Policies pages ([#351](https://github.com/CIROH-UA/ciroh-ua_website/pull/351))\\n- DataStream CLI key features clarified ([#349](https://github.com/CIROH-UA/ciroh-ua_website/pull/349))\\n- New social media icons in footer ([#341](https://github.com/CIROH-UA/ciroh-ua_website/pull/341))\\n\\n\x3c!-- truncate --\x3e"},{"id":"v20250416","metadata":{"permalink":"/docuhub-staging/release-notes/v20250416","source":"@site/release-notes/2025-04-16-release-notes.mdx","title":"04-16-2025 Release Notes","description":"A new blog post has been added for April 2025!","date":"2025-04-16T00:00:00.000Z","tags":[{"inline":true,"label":"Release Notes","permalink":"/docuhub-staging/release-notes/tags/release-notes"},{"inline":true,"label":"DocuHub","permalink":"/docuhub-staging/release-notes/tags/docu-hub"}],"readingTime":0.31,"hasTruncateMarker":true,"authors":[],"frontMatter":{"title":"04-16-2025 Release Notes","description":"A new blog post has been added for April 2025!","slug":"v20250416","tags":["Release Notes","DocuHub"],"hide_table_of_contents":false},"unlisted":false,"prevItem":{"title":"05-05-2025 Release Notes","permalink":"/docuhub-staging/release-notes/v20250505"},"nextItem":{"title":"04-08-2025 Release Notes","permalink":"/docuhub-staging/release-notes/v20250408"}},"content":"## Blog posts and news updates\\n- Blog post: [\\"Google Cloud Next 2025: Innovation at Scale\\"](/blog/april-2025-update) ([#345](https://github.com/CIROH-UA/ciroh-ua_website/pull/345))\\n\\n## Updates\\n- Blog\'s left sidebar now correctly displays all posts ([#350](https://github.com/CIROH-UA/ciroh-ua_website/pull/350))\\n- News and Contribute pages improved on mobile ([#340](https://github.com/CIROH-UA/ciroh-ua_website/pull/340))\\n\\n\x3c!-- truncate --\x3e"},{"id":"v20250408","metadata":{"permalink":"/docuhub-staging/release-notes/v20250408","source":"@site/release-notes/2025-04-08-release-notes.mdx","title":"04-08-2025 Release Notes","description":"Major DocuHub update for April 2025!","date":"2025-04-08T00:00:00.000Z","tags":[{"inline":true,"label":"Release Notes","permalink":"/docuhub-staging/release-notes/tags/release-notes"},{"inline":true,"label":"DocuHub","permalink":"/docuhub-staging/release-notes/tags/docu-hub"}],"readingTime":1.18,"hasTruncateMarker":true,"authors":[],"frontMatter":{"title":"04-08-2025 Release Notes","description":"Major DocuHub update for April 2025!","slug":"v20250408","tags":["Release Notes","DocuHub"],"hide_table_of_contents":false},"unlisted":false,"prevItem":{"title":"04-16-2025 Release Notes","permalink":"/docuhub-staging/release-notes/v20250416"}},"content":"## New content\\n- Community Hydrologic Modeling page now features tables detailing features and access methods ([#290](https://github.com/CIROH-UA/ciroh-ua_website/pull/290))\\n- Added NGIAB-TEEHR and NGIAB-CLIENT to products section ([#320](https://github.com/CIROH-UA/ciroh-ua_website/pull/320))\\n- Added Flood Inundation Mapping Framework to products section ([#300](https://github.com/CIROH-UA/ciroh-ua_website/pull/300))\\n- Added documentation on debugging Python package conflicts in CIROH-2i2c JupyterHub ([#308](https://github.com/CIROH-UA/ciroh-ua_website/pull/308))\\n- Added tutorial for running datapreprocess on CIROH-2i2c JupyterHub ([#299](https://github.com/CIROH-UA/ciroh-ua_website/pull/299))\\n\\n## Blog posts and news updates\\n- Blog post: [\\"UA\'s Alabama Water Institute Showcases 30-Minute Hydrological Modeling Revolution\\"](/blog/march-2025-update) ([#310](https://github.com/CIROH-UA/ciroh-ua_website/pull/310))\\n- News update: March 2025 ([#306](https://github.com/CIROH-UA/ciroh-ua_website/pull/306))\\n\\n## Updates\\n- Office Hours page updated; added to homepage and Contact page ([#337](https://github.com/CIROH-UA/ciroh-ua_website/pull/337))\\n- Contribute page heavily reworked; now features GitHub issue templates ([#309](https://github.com/CIROH-UA/ciroh-ua_website/pull/309))\\n- Added link to National Water Model API documentation ([#307](https://github.com/CIROH-UA/ciroh-ua_website/pull/307))\\n- Added graphical headers to News tab ([#305](https://github.com/CIROH-UA/ciroh-ua_website/pull/305))\\n- Guidance on accessing services and resources refactored ([#287](https://github.com/CIROH-UA/ciroh-ua_website/pull/287), [#294](https://github.com/CIROH-UA/ciroh-ua_website/pull/294))\\n\\n\x3c!-- truncate --\x3e"}]}}')}}]);